{
  "project_id": "project-ops-automation-studio",
  "stored_at": "2025-01-15T13:15:00Z",
  "format": "json",
  "version": "v1",
  "storage": {
    "provider_id": "store-001",
    "namespace_id": "ns-projects",
    "object_path": "projects/project-ops-automation-studio/config.json",
    "checksum": "sha256:0a1b2c3d4e5f6a7b8c9d0e1f2a3b4c5d6e7f8a9b0c1d2e3f4a5b6c7d8e9f0a1b",
    "size_bytes": 1024,
    "content_type": "application/json"
  }
}
